{
  "format": "ac-mfusion",
  "version": "0.1",
  "encoding": "float",
  "number_field": "cyclotomic(1)",
  "category_type": "mfusion",
  "_meta": { "note": "Rep(D8) toy example (not full, just structurally valid v0)" },

  "simple_objects": ["1", "a", "b", "c", "d"],

  "dual": {
    "1": "1",
    "a": "a",
    "b": "b",
    "c": "c",
    "d": "d"
  },

  "fusion_rules": {
    "(1,1)": { "1": 1 },
    "(1,a)": { "a": 1 },
    "(1,b)": { "b": 1 },
    "(1,c)": { "c": 1 },
    "(1,d)": { "d": 1 },

    "(a,1)": { "a": 1 },
    "(a,a)": { "1": 1 },
    "(a,b)": { "b": 1 },
    "(a,c)": { "c": 1 },
    "(a,d)": { "d": 1 },

    "(b,1)": { "b": 1 },
    "(b,a)": { "b": 1 },
    "(b,b)": { "1": 1 },
    "(b,c)": { "d": 1 },
    "(b,d)": { "c": 1 },

    "(c,1)": { "c": 1 },
    "(c,a)": { "c": 1 },
    "(c,b)": { "d": 1 },
    "(c,c)": { "1": 1 },
    "(c,d)": { "b": 1 },

    "(d,1)": { "d": 1 },
    "(d,a)": { "d": 1 },
    "(d,b)": { "c": 1 },
    "(d,c)": { "b": 1 },
    "(d,d)": { "1": 1 }
  }
}
